{"authority_boundary":{"may_change_fpo_authority":false,"return_only":true},"capability_id":"ai.public-research.capability","capability_revision":"phase4b-v1","capability_run_id":"research-B5-001","case_id":"B5","dispatch_id":"DISP-B5-001","fixture_ref":"phase4b/fixtures/B5-end-to-end-recovery.json","operation_id":"OP-B5-001","research_budget":{"max_accepted_sources":6,"max_distinct_queries":6,"max_research_rounds":3},"return_schema_ref":"phase4b/contracts/research_return.schema.json","schema":"fpo.phase4b.research-dispatch.v1","source_policy":"public read-only; official or primary sources preferred; do not use model memory as evidence"}
